{
  "id": "course-lit-reading",
  "disciplineId": "literature",
  "nodeId": "lit-reading",
  "title": "How to Read Literature",
  "summary": "Build the core habits of literary study: close reading, active annotation, genre awareness, and interpretive discipline across poems, stories, and plays.",
  "estimatedTime": "4-6 hours",
  "learningObjectives": [
    "Perform close reading on diction, imagery, tone, and structure",
    "Distinguish narrative, lyric, and dramatic modes of writing",
    "Use active reading strategies that support interpretation instead of passive summary"
  ],
  "lessons": [
    "lesson-lit-reading-close-reading",
    "lesson-lit-reading-modes-and-strategies"
  ],
  "quizIds": [
    "quiz-lit-reading-check-1"
  ],
  "testId": "test-lit-reading-core",
  "labIds": [
    "lab-lit-reading-annotation"
  ],
  "projectIds": [
    "project-lit-reading-commonplace"
  ],
  "mediaIds": [
    "media-lit-reading-wikipedia",
    "media-lit-reading-youtube-1"
  ],
  "masteryCriteria": [
    "Pass the literary reading test at 80 percent or above",
    "Complete the annotation lab",
    "Finish the commonplace book project"
  ]
}