{
  "id": "course-hist-archaeology",
  "disciplineId": "history",
  "nodeId": "hist-archaeology",
  "title": "Archaeology and Dating",
  "summary": "Learn how archaeologists recover, date, and interpret material evidence, from stratigraphy and radiocarbon analysis to LiDAR and ancient DNA.",
  "estimatedTime": "5-7 hours",
  "learningObjectives": [
    "Explain how excavation context and stratigraphy structure archaeological reasoning",
    "Compare major dating methods and their limits",
    "Describe how remote sensing and ancient DNA have changed interpretations of the human past"
  ],
  "lessons": [
    "lesson-hist-archaeology-excavation",
    "lesson-hist-archaeology-dating"
  ],
  "quizIds": [
    "quiz-hist-archaeology-check-1"
  ],
  "testId": "test-hist-archaeology-core",
  "labIds": [
    "lab-hist-archaeology-context-grid"
  ],
  "projectIds": [
    "project-hist-archaeology-site-brief"
  ],
  "mediaIds": [
    "media-hist-archaeology-wikipedia",
    "media-hist-archaeology-youtube-1"
  ],
  "masteryCriteria": [
    "Pass the archaeology core test at 80 percent or above",
    "Complete the context grid lab",
    "Finish the archaeological site brief project"
  ]
}