{
  "id": "course-phil-foundations",
  "disciplineId": "philosophy",
  "nodeId": "phil-foundations",
  "title": "Foundations and Method",
  "summary": "Build the core habits of philosophical study: reading arguments carefully, analyzing concepts, and using thought experiments with discipline.",
  "estimatedTime": "4-5 hours",
  "learningObjectives": [
    "Explain what distinguishes philosophical inquiry from neighboring disciplines",
    "Read arguments charitably and reconstruct them in premise-conclusion form",
    "Use conceptual analysis and thought experiments to test claims"
  ],
  "lessons": [
    "lesson-phil-foundations-orientation",
    "lesson-phil-foundations-methods"
  ],
  "quizIds": [
    "quiz-phil-foundations-check-1"
  ],
  "testId": "test-phil-foundations-core",
  "labIds": [
    "lab-phil-foundations-argument-map"
  ],
  "projectIds": [
    "project-phil-foundations-dialogue"
  ],
  "mediaIds": [
    "media-phil-foundations-wikipedia",
    "media-phil-foundations-youtube-1"
  ],
  "masteryCriteria": [
    "Pass the foundations test at 80 percent or above",
    "Complete the argument mapping lab",
    "Finish the philosophical dialogue project"
  ]
}